{"manifest_version":1,"scope":"complete_camera_files","status":"complete","product":"wow_classic_beta","build":70205,"locale":"enUS","extractor":"forever-camera-extract","extractor_version":"0.1.0","oracle_commit":"02245dcd245e7433e524577656177723d3e4992e","db2_metadata_sha256":"897bde5aa04bab3b40ce4fe2e34d2127385b11d908d5266dce0fae7b52e23def","discovery_policy":"direct_rows_u32_field3_v1","max_source_bytes":16777216,"max_file_bytes":16777216,"max_files":4096,"max_total_bytes":268435456,"offline":true,"downloaded_bytes":0,"paths_redacted":true,"full_client_extraction":false,"m2_parsed":false,"waypoints_generated":false,"runtime_accepted":false,"source":{"name":"CinematicCamera.db2","file_id":1294214,"relative_path":"dbc/enUS/CinematicCamera.db2","layout_hash":2348643627,"status":"complete","bytes":488,"sha256":"ea7cd3876f2f18eba3e6849856055aa60ffa97d9398960563f668e401a0fd35c","error_code":null,"direct_records":3,"unique_file_ids":2,"file_id_set_sha256":"527434a55f745fd61afdc8f3114f88e538050f3ea6a0e68258c6403f9cee021c"},"cameras":[{"file_id":11,"relative_path":"cameras/FILE0000000B.xxx","status":"complete","bytes":22,"sha256":"9be5f7201018ef6cfe9c152df56e82a337962e9831c42dc6e89d5f45b2d7b42a","error_code":null},{"file_id":12,"relative_path":"cameras/FILE0000000C.xxx","status":"complete","bytes":22,"sha256":"ed8fab0f9a588e21ddf1dfc30b89791ff9db42c028865fefc7f4a1eeaac86b39","error_code":null}],"integrity":{"file_count":3,"total_bytes":532,"inventory_sha256":"04b70510fd55f78f172424a1f27dff3e3a3d4609035ba20a76bb39a63339a431"}}
